{
  "$schema": "http://json-schema.org/draft-07/schema#",
  "title": "Ollama Cloud catalog",
  "type": "object",
  "required": ["provider", "generatedAt", "modelsHash", "models"],
  "properties": {
    "$schema": { "type": "string" },
    "provider": {
      "type": "object",
      "required": ["id", "name", "api", "npm", "env"],
      "properties": {
        "id": { "type": "string", "const": "ollama-cloud" },
        "name": { "type": "string" },
        "api": { "type": "string" },
        "npm": { "type": "string" },
        "env": { "type": "array", "items": { "type": "string" } }
      }
    },
    "generatedAt": { "type": "string", "format": "date-time" },
    "modelsHash": { "type": "string" },
    "models": {
      "type": "array",
      "items": {
        "type": "object",
        "required": [
          "id",
          "name",
          "created",
          "family",
          "capabilities",
          "input",
          "context",
          "maxOutput",
          "reasoningOptions",
          "releaseDate"
        ],
        "properties": {
          "id": { "type": "string" },
          "name": { "type": "string" },
          "created": { "type": "number" },
          "family": { "type": "string" },
          "capabilities": {
            "type": "object",
            "required": ["tools", "thinking", "vision"],
            "properties": {
              "tools": { "type": "boolean" },
              "thinking": { "type": "boolean" },
              "vision": { "type": "boolean" }
            }
          },
          "input": {
            "type": "array",
            "items": { "enum": ["text", "image"] }
          },
          "context": { "type": "number", "minimum": 1 },
          "maxOutput": { "type": "number", "minimum": 1 },
          "reasoningOptions": {
            "type": "array",
            "items": { "type": "string" }
          },
          "releaseDate": { "type": "string" },
          "quantization": { "type": "string", "minLength": 1 },
          "pricing": {
            "type": "object",
            "required": [
              "input",
              "output",
              "unit",
              "provider",
              "source",
              "asOf"
            ],
            "properties": {
              "input": { "type": "number", "exclusiveMinimum": 0 },
              "output": { "type": "number", "exclusiveMinimum": 0 },
              "unit": { "const": "per-1M" },
              "provider": { "type": "string" },
              "source": { "type": "string" },
              "asOf": { "type": "string", "format": "date" },
              "note": { "type": "string" }
            }
          },
          "sources": {
            "type": "object",
            "additionalProperties": { "type": "string" }
          },
          "conflicts": { "type": "object" }
        }
      }
    }
  }
}
