{
  "$schema": "./catalog.schema.json",
  "provider": {
    "id": "ollama-cloud",
    "name": "Ollama Cloud",
    "api": "https://ollama.com/v1",
    "npm": "@ai-sdk/openai-compatible",
    "env": ["OLLAMA_API_KEY"]
  },
  "generatedAt": "2026-09-01T04:55:01.525Z",
  "modelsHash": "e06ea128b326f65bf969a63418eba2277f53ca5e4b266ee92d049054d45609a4",
  "models": [
    {
      "id": "glm-5.3",
      "name": "GLM 5.3",
      "created": 1787929200,
      "family": "glm-5.3",
      "capabilities": {
        "tools": true,
        "thinking": true,
        "vision": false
      },
      "input": ["text"],
      "context": 1048576,
      "maxOutput": 131072,
      "reasoningOptions": ["low", "high", "max"],
      "releaseDate": "2026-08-14",
      "sources": {
        "quantization": "registry-ollama"
      },
      "quantization": "FP8"
    },
    {
      "id": "glm-5.3-flash",
      "name": "GLM 5.3 Flash",
      "created": 1787752800,
      "family": "glm-5.3-flash",
      "capabilities": {
        "tools": true,
        "thinking": true,
        "vision": true
      },
      "input": ["text", "image"],
      "context": 1048576,
      "maxOutput": 131072,
      "reasoningOptions": ["low", "high", "max"],
      "releaseDate": "2026-08-26",
      "sources": {
        "quantization": "registry-ollama"
      },
      "quantization": "FP8"
    },
    {
      "id": "deepseek-v4-pro:0813",
      "name": "Deepseek V4 Pro (0813)",
      "created": 1786633200,
      "family": "deepseek-v4-pro",
      "capabilities": {
        "tools": true,
        "thinking": true,
        "vision": false
      },
      "input": ["text"],
      "context": 1048576,
      "maxOutput": 1048576,
      "reasoningOptions": ["high", "max"],
      "releaseDate": "2026-04-24",
      "sources": {
        "quantization": "registry-ollama"
      },
      "quantization": "FP8"
    },
    {
      "id": "deepseek-v4-flash:0731",
      "name": "Deepseek V4 Flash (0731)",
      "created": 1785510000,
      "family": "deepseek-v4-flash",
      "capabilities": {
        "tools": true,
        "thinking": true,
        "vision": false
      },
      "input": ["text"],
      "context": 1048576,
      "maxOutput": 1048576,
      "reasoningOptions": ["high", "max"],
      "releaseDate": "2026-07-31",
      "sources": {
        "quantization": "registry-ollama"
      },
      "quantization": "FP8"
    },
    {
      "id": "kimi-k3",
      "name": "Kimi K3",
      "created": 1785164400,
      "family": "kimi-k3",
      "capabilities": {
        "tools": true,
        "thinking": true,
        "vision": true
      },
      "input": ["text", "image"],
      "context": 1048576,
      "maxOutput": 131072,
      "reasoningOptions": ["low", "high", "max"],
      "releaseDate": "2026-07-16",
      "sources": {
        "quantization": "registry-ollama"
      },
      "quantization": "MXFP4"
    },
    {
      "id": "glm-5.2",
      "name": "GLM 5.2",
      "created": 1781622000,
      "family": "glm-5.2",
      "capabilities": {
        "tools": true,
        "thinking": true,
        "vision": false
      },
      "input": ["text"],
      "context": 999424,
      "maxOutput": 131072,
      "reasoningOptions": ["high", "max"],
      "releaseDate": "2026-06-13",
      "sources": {
        "quantization": "implicit-hf (zai-org/GLM-5.2-FP8 checkpoint + glm family FP8)"
      },
      "quantization": "FP8"
    },
    {
      "id": "kimi-k2.7-code",
      "name": "Kimi K2.7 Code",
      "created": 1781222400,
      "family": "kimi-k2.7-code",
      "capabilities": {
        "tools": true,
        "thinking": true,
        "vision": true
      },
      "input": ["text", "image"],
      "context": 262144,
      "maxOutput": 262144,
      "reasoningOptions": [],
      "releaseDate": "2026-06-12",
      "sources": {
        "quantization": "registry-ollama"
      },
      "quantization": "INT4"
    },
    {
      "id": "nemotron-3-ultra",
      "name": "Nemotron 3 Ultra",
      "created": 1780531200,
      "family": "nemotron-3-ultra",
      "capabilities": {
        "tools": true,
        "thinking": true,
        "vision": false
      },
      "input": ["text"],
      "context": 262144,
      "maxOutput": 128000,
      "reasoningOptions": [],
      "releaseDate": "2026-06-04",
      "sources": {
        "quantization": "implicit-library (nemotron-3-ultra library README + NVIDIA checkpoints)"
      },
      "quantization": "NVFP4"
    },
    {
      "id": "minimax-m3",
      "name": "Minimax M3",
      "created": 1780272000,
      "family": "minimax-m3",
      "capabilities": {
        "tools": true,
        "thinking": true,
        "vision": true
      },
      "input": ["text", "image"],
      "context": 524288,
      "maxOutput": 131072,
      "reasoningOptions": ["low", "medium", "high", "max"],
      "releaseDate": "2026-05-31",
      "sources": {
        "quantization": "no defensible source"
      },
      "quantization": "unknown"
    },
    {
      "id": "kimi-k2.6",
      "name": "Kimi K2.6",
      "created": 1776643200,
      "family": "kimi-k2.6",
      "capabilities": {
        "tools": true,
        "thinking": true,
        "vision": true
      },
      "input": ["text", "image"],
      "context": 262144,
      "maxOutput": 262144,
      "reasoningOptions": [],
      "releaseDate": "2026-04-20",
      "sources": {
        "quantization": "registry-ollama"
      },
      "quantization": "INT4"
    },
    {
      "id": "glm-5.1",
      "name": "GLM 5.1",
      "created": 1775574000,
      "family": "glm-5.1",
      "capabilities": {
        "tools": true,
        "thinking": true,
        "vision": false
      },
      "input": ["text"],
      "context": 202752,
      "maxOutput": 131072,
      "reasoningOptions": [],
      "releaseDate": "2026-03-27",
      "sources": {
        "quantization": "registry-ollama"
      },
      "quantization": "FP8"
    },
    {
      "id": "gemma4:31b",
      "name": "Gemma4 (31b)",
      "created": 1775149200,
      "family": "gemma4",
      "capabilities": {
        "tools": true,
        "thinking": true,
        "vision": true
      },
      "input": ["text", "image"],
      "context": 262144,
      "maxOutput": 262144,
      "reasoningOptions": [],
      "releaseDate": "2026-04-02",
      "sources": {
        "quantization": "registry-ollama"
      },
      "quantization": "BF16"
    },
    {
      "id": "minimax-m2.7",
      "name": "Minimax M2.7",
      "created": 1773792000,
      "family": "minimax-m2.7",
      "capabilities": {
        "tools": true,
        "thinking": true,
        "vision": false
      },
      "input": ["text"],
      "context": 204800,
      "maxOutput": 196608,
      "reasoningOptions": [],
      "releaseDate": "2026-03-18",
      "sources": {
        "quantization": "no defensible source"
      },
      "quantization": "unknown"
    },
    {
      "id": "nemotron-3-super",
      "name": "Nemotron 3 Super",
      "created": 1773187200,
      "family": "nemotron-3-super",
      "capabilities": {
        "tools": true,
        "thinking": true,
        "vision": false
      },
      "input": ["text"],
      "context": 262144,
      "maxOutput": 65536,
      "reasoningOptions": [],
      "releaseDate": "2026-03-11",
      "sources": {
        "quantization": "registry-ollama"
      },
      "quantization": "NVFP4"
    },
    {
      "id": "qwen3.5:397b",
      "name": "Qwen3.5 (397b)",
      "created": 1771200000,
      "family": "qwen3.5",
      "capabilities": {
        "tools": true,
        "thinking": true,
        "vision": true
      },
      "input": ["text", "image"],
      "context": 262144,
      "maxOutput": 65536,
      "reasoningOptions": [],
      "releaseDate": "2026-02-15",
      "sources": {
        "quantization": "registry-ollama"
      },
      "quantization": "BF16"
    },
    {
      "id": "nemotron-3-nano:30b",
      "name": "Nemotron 3 Nano (30b)",
      "created": 1765756800,
      "family": "nemotron-3-nano",
      "capabilities": {
        "tools": true,
        "thinking": true,
        "vision": false
      },
      "input": ["text"],
      "context": 1048576,
      "maxOutput": 131072,
      "reasoningOptions": [],
      "releaseDate": "2025-12-15",
      "sources": {
        "quantization": "registry-ollama"
      },
      "quantization": "FP8"
    },
    {
      "id": "mistral-large-3:675b",
      "name": "Mistral Large 3 (675b)",
      "created": 1764633600,
      "family": "mistral-large-3",
      "capabilities": {
        "tools": true,
        "thinking": false,
        "vision": true
      },
      "input": ["text", "image"],
      "context": 262144,
      "maxOutput": 262144,
      "reasoningOptions": [],
      "releaseDate": "2025-12-02",
      "sources": {
        "quantization": "registry-ollama"
      },
      "quantization": "FP8"
    },
    {
      "id": "gpt-oss:120b",
      "name": "GPT OSS (120b)",
      "created": 1754352000,
      "family": "gpt-oss",
      "capabilities": {
        "tools": true,
        "thinking": true,
        "vision": false
      },
      "input": ["text"],
      "context": 131072,
      "maxOutput": 32768,
      "reasoningOptions": ["low", "medium", "high"],
      "releaseDate": "2025-08-05",
      "sources": {
        "quantization": "registry-ollama"
      },
      "quantization": "MXFP4"
    },
    {
      "id": "gpt-oss:20b",
      "name": "GPT OSS (20b)",
      "created": 1754352000,
      "family": "gpt-oss",
      "capabilities": {
        "tools": true,
        "thinking": true,
        "vision": false
      },
      "input": ["text"],
      "context": 131072,
      "maxOutput": 32768,
      "reasoningOptions": ["low", "medium", "high"],
      "releaseDate": "2025-08-05",
      "sources": {
        "quantization": "registry-ollama"
      },
      "quantization": "MXFP4"
    }
  ]
}
